{
  "schemaVersion": "workflow-command-envelope.v1",
  "intendedProducer": "Archon",
  "intendedConsumer": "Hermes",
  "owningSubproject": "archon",
  "provider": "archon",
  "command": "workflow.retry",
  "correlationId": "corr_story_3_3d_workflow_retry_node",
  "issuedAt": "2026-07-20T12:05:00Z",
  "success": true,
  "workflowRunRef": {
    "provider": "archon",
    "runId": "archon-run-story-3-3d-001",
    "workflowName": "bmad-dev-story",
    "projectRef": "project:workflow-engine"
  },
  "result": {
    "operation": "retry",
    "scope": "node",
    "nodeId": "implement-story",
    "dispatched": true,
    "detached": true
  }
}
