{
  "schemaVersion": "workflow-command-envelope.v1",
  "intendedProducer": "Archon",
  "intendedConsumer": "Hermes",
  "owningSubproject": "archon",
  "provider": "archon",
  "command": "binding.update",
  "correlationId": "corr_story_1_3a_binding_update_command",
  "issuedAt": "2026-07-11T11:48:27Z",
  "success": true,
  "bindingRef": {
    "provider": "archon",
    "name": "workflow-engine-primary",
    "bindingId": "wpb_archon_workflow_engine_primary",
    "projectRef": "project:workflow-engine"
  },
  "result": {
    "operation": "update",
    "state": "active",
    "updated": true,
    "bindingVersion": 1
  }
}
